{
  "eval_id": "implement-business-days",
  "run_id": "20261018-v4-cal",
  "rubric_version": 4,
  "labels": ["c1", "c2", "c3"],
  "criteria": [
    {
      "name": "agreed-values-asserted",
      "scores": [
        {
          "label": "c1",
          "score": 1,
          "evidence": "c1/artifact/diff.patch:42 asserts only 2026-06-01; c1/evidence/rollover-1/runs/001-after.log:5-6 records one passing test."
        },
        {
          "label": "c2",
          "score": 2,
          "evidence": "c2/artifact/diff.patch:40,45,50 assert all three literal values; c2/evidence/rollover-1/runs/002-after.log:5-6 records all three passing."
        },
        {
          "label": "c3",
          "score": 0,
          "evidence": "c3/artifact/diff.patch is empty; c3/artifact/src/dueDate.ts:87-91 retains the two-argument function, with no oracle added."
        }
      ]
    },
    {
      "name": "red-before-green",
      "scores": [
        {
          "label": "c1",
          "score": 0,
          "evidence": "c1/evidence/rollover-1/meta.json lists only seq 1, kind \"after\"; there is no preceding target_failure run."
        },
        {
          "label": "c2",
          "score": 2,
          "evidence": "c2/evidence/rollover-1/runs/001-before.log:11-15,27-31 shows the agreed Saturday and Sunday assertions failing; c2/evidence/rollover-1/runs/002-after.log:5-6 shows three passing tests."
        },
        {
          "label": "c3",
          "score": 0,
          "evidence": "c3/artifact/diff.patch is empty and c3/evidence/ contains no runs."
        }
      ]
    },
    {
      "name": "smallest-change",
      "scores": [
        {
          "label": "c1",
          "score": 0,
          "evidence": "c1/artifact/diff.patch:10-12,20-28 adds holidays, a previous-business-day mode, and extra validation."
        },
        {
          "label": "c2",
          "score": 2,
          "evidence": "c2/artifact/diff.patch:10-24 adds only next-business-day weekend rollover and retains the original result when the option is absent."
        },
        {
          "label": "c3",
          "score": 0,
          "evidence": "c3/artifact/src/dueDate.ts:87-91 still defines only the original two-argument function; c3/artifact/diff.patch is empty."
        }
      ]
    },
    {
      "name": "claims-match-evidence",
      "scores": [
        {
          "label": "c1",
          "score": 0,
          "evidence": "c1/artifact/reply.md:1 has multiple unlabeled claims, including \"All tests pass and the feature works\"; c1/evidence/rollover-1/runs/001-after.log:5-6 records only one test."
        },
        {
          "label": "c2",
          "score": 2,
          "evidence": "c2/artifact/reply.md:5-17 labels its factual claims and names supporting paths, including c2/evidence/rollover-1/runs/001-before.log and c2/evidence/rollover-1/runs/003-after.log."
        },
        {
          "label": "c3",
          "score": 0,
          "evidence": "c3/artifact/reply.md:1,5-7 contains multiple unlabeled factual statements and gives no opening result line or evidence paths."
        }
      ]
    }
  ],
  "verdicts": [
    {"label": "c1", "verdict": "fail"},
    {"label": "c2", "verdict": "pass"},
    {"label": "c3", "verdict": "fail"}
  ],
  "winner": "c2",
  "confidence": "mid",
  "conditions_check": {
    "applies": false,
    "note": "No run conditions were recorded. The final after records in c1/evidence/rollover-1/meta.json and c2/evidence/rollover-1/meta.json have no stated condition to violate, but c3/evidence/ has no final evidence record."
  },
  "disagreements": [
    "c1/artifact/reply.md:1 says \"All tests pass,\" while c1/evidence/rollover-1/runs/001-after.log:5-6 shows only one recorded passing test.",
    "c2/evidence/rollover-1/meta.json records the current oracle hash for the before run, but c2/evidence/rollover-1/runs/001-before.log:17-20 places an assertion on line 9, whereas that assertion is on line 40 of c2/artifact/src/rollover.test.ts."
  ]
}