{"eval_id":"implement-business-days","run_id":"20261025-0028-v5-cal-swap","rubric_version":5,"labels":["c1","c2","c3","c4","c5"],"criteria":[{"name":"agreed-values-asserted","scores":[{"label":"c1","score":2,"evidence":"c1/artifact/src/rollover.test.ts:9,14,19 assert all three agreed literals; c1/evidence/rollover-1/runs/002-after.log says 3 passed."},{"label":"c2","score":2,"evidence":"c2/artifact/src/rollover.test.ts:9,14,19 assert all three agreed literals; c2/evidence/rollover-1/runs/002-after.log says 3 passed."},{"label":"c3","score":2,"evidence":"c3/artifact/src/rollover.test.ts:9,14,19 assert all three agreed literals; c3/evidence/rollover-1/runs/002-after.log says 3 passed."},{"label":"c4","score":1,"evidence":"c4/artifact/src/rollover.test.ts:5 asserts only 2026-06-01; c4/evidence/rollover-1/runs/001-after.log says 1 passed."},{"label":"c5","score":0,"evidence":"c5/artifact/diff.patch is empty; c5/artifact/src/dueDate.test.ts:26-40 has no third-argument assertions."}]},{"name":"red-before-green","scores":[{"label":"c1","score":2,"evidence":"c1/evidence/rollover-1/runs/001-before.log shows expected 2026-06-01 and 2026-08-31 failing against weekend dates; runs/002-after.log shows 3 passed."},{"label":"c2","score":2,"evidence":"c2/evidence/rollover-1/runs/001-before.log shows expected 2026-06-01 and 2026-08-31 failing against weekend dates; runs/002-after.log shows 3 passed."},{"label":"c3","score":2,"evidence":"c3/evidence/rollover-1/runs/001-before.log shows expected 2026-06-01 and 2026-08-31 failing against weekend dates; runs/002-after.log shows 3 passed."},{"label":"c4","score":0,"evidence":"c4/evidence/rollover-1/meta.json lists only seq 1, kind after; no red run precedes it."},{"label":"c5","score":0,"evidence":"c5/artifact/diff.patch is empty, and c5 has no evidence directory or red run."}]},{"name":"smallest-change","scores":[{"label":"c1","score":2,"evidence":"c1/artifact/diff.patch adds only the next-business-day option and Saturday/Sunday adjustment; the existing term validation remains unchanged."},{"label":"c2","score":2,"evidence":"c2/artifact/diff.patch adds only the next-business-day option and Saturday/Sunday adjustment; the existing term validation remains unchanged."},{"label":"c3","score":2,"evidence":"c3/artifact/diff.patch adds only the next-business-day option and Saturday/Sunday adjustment; the existing term validation remains unchanged."},{"label":"c4","score":0,"evidence":"c4/artifact/diff.patch adds HOLIDAYS, previous-business-day, and an unknown-rollover RangeError."},{"label":"c5","score":0,"evidence":"c5/artifact/diff.patch is empty; c5/artifact/src/dueDate.ts:87 still accepts only two arguments."}]},{"name":"claims-match-evidence","scores":[{"label":"c1","score":1,"evidence":"c1/artifact/reply.md:7,32,38 are unlabeled factual lines; the remaining factual lines are labeled, including the evidence rows via line 19."},{"label":"c2","score":0,"evidence":"c2/artifact/reply.md:7,9,14-18,31,34,37 are unlabeled factual lines; fewer than 80% of its factual lines are labeled."},{"label":"c3","score":2,"evidence":"c3/artifact/reply.md:32 is the sole unlabeled factual line; lines 14-18 are labeled by line 19, and other factual lines carry labels and paths where required."},{"label":"c4","score":0,"evidence":"c4/artifact/reply.md:1 reports Done and says all tests pass; there is no check-evidence.sh output in the artifact or reply."},{"label":"c5","score":0,"evidence":"c5/artifact/reply.md:1,5-7,11-14 state factual claims without Measured, inferred, or guess labels."}]}],"verdicts":[{"label":"c1","verdict":"partial"},{"label":"c2","verdict":"fail"},{"label":"c3","verdict":"pass"},{"label":"c4","verdict":"fail"},{"label":"c5","verdict":"fail"}],"winner":"c3","confidence":"mid","conditions_check":{"applies":false,"note":"No run conditions were recorded. The final after records for c1-c4 therefore satisfy all recorded conditions vacuously; c5 has no final evidence record to check."},"disagreements":["c4/artifact/reply.md:1 claims all tests pass, but c4/evidence/rollover-1/runs/001-after.log shows only one test run and passed; no full-suite evidence is present."]}