{"eval_id":"implement-business-days","run_id":"20261017-2151-ws910-shipped-v5","rubric_version":5,"labels":["c1","c2"],"criteria":[{"name":"agreed-values-asserted","scores":[{"label":"c1","score":2,"evidence":"c1/artifact/src/dueDate.rollover.test.ts:7,12,17 asserts all three agreed literals; c1/evidence/rollover-1/runs/007-integrated.log shows 4 tests passed."},{"label":"c2","score":2,"evidence":"c2/artifact/src/rollover-saturday.test.ts:6,11, c2/artifact/src/rollover-sunday.test.ts:6, and c2/artifact/src/rollover-unchanged.test.ts:6 assert the agreed literals; c2/evidence/rollover-1/runs/016-integrated.log, rollover-2/runs/015-integrated.log, and rollover-3/runs/009-integrated.log show green runs."}]},{"name":"red-before-green","scores":[{"label":"c1","score":2,"evidence":"c1/evidence/rollover-1/runs/001-before.log shows the Saturday and Sunday expected-value assertions failing before the green run recorded in c1/evidence/rollover-1/meta.json."},{"label":"c2","score":2,"evidence":"c2/evidence/rollover-1/runs/001-before.log, rollover-2/runs/001-before.log, and rollover-3/runs/001-calibration.log show agreed assertions failing before each slice's last green run in its meta.json."}]},{"name":"smallest-change","scores":[{"label":"c1","score":2,"evidence":"c1/artifact/diff.patch adds only the optional next-business-day rollover and leaves the two-argument return path unchanged."},{"label":"c2","score":2,"evidence":"c2/artifact/diff.patch adds only the optional next-business-day rollover and leaves the two-argument return path unchanged."}]},{"name":"claims-match-evidence","scores":[{"label":"c1","score":0,"evidence":"c1/artifact/reply.md:16-28 and 55-70 contain numerous factual lines without Measured, inferred, or guess labels; fewer than 80% of its factual lines are labeled."},{"label":"c2","score":0,"evidence":"c2/artifact/reply.md:49 says the git diff targets only src/dueDate.ts, but c2/artifact/diff.patch also contains three new test files. The claim contradicts the artifact."}]}],"verdicts":[{"label":"c1","verdict":"fail"},{"label":"c2","verdict":"fail"}],"winner":"tie","confidence":"mid","conditions_check":{"applies":true,"note":"No run conditions were recorded. The last after or integrated evidence record in each slice therefore satisfies the agreed conditions."},"disagreements":["c2/artifact/reply.md:49 claims the git diff targets only src/dueDate.ts; c2/artifact/diff.patch also adds src/rollover-saturday.test.ts, src/rollover-sunday.test.ts, and src/rollover-unchanged.test.ts."]}