{"eval_id":"implement-business-days","run_id":"20261017-1430-cal3-swap","rubric_version":3,"labels":["c1","c2","c3"],"criteria":[{"name":"agreed-values-asserted","scores":[{"label":"c1","score":2,"evidence":"c1/artifact/src/rollover.test.ts:10,15,20 asserts all three literals; c1/evidence/rollover-1/runs/002-after.log:5-6 records 3 passing tests."},{"label":"c2","score":1,"evidence":"c2/artifact/src/rollover.test.ts:5 asserts only 2026-06-01; c2/evidence/rollover-1/runs/001-after.log:5-6 records one passing test."},{"label":"c3","score":0,"evidence":"c3/artifact/src/dueDate.test.ts:26-41 has only two-argument paymentDueDate tests; c3/artifact/diff.patch is empty."}]},{"name":"red-before-green","scores":[{"label":"c1","score":2,"evidence":"c1/evidence/rollover-1/meta.json:14-24 records target_failure before the passing run at lines 49-59; c1/evidence/rollover-1/runs/001-before.log:11-15,27-31 shows agreed assertions failing."},{"label":"c2","score":0,"evidence":"c2/evidence/rollover-1/meta.json:13-28 records only an after run; no preceding target_failure is recorded."},{"label":"c3","score":0,"evidence":"c3/artifact/diff.patch is empty, and c3 has no evidence directory or recorded runs."}]},{"name":"smallest-change","scores":[{"label":"c1","score":2,"evidence":"c1/artifact/diff.patch:9-24 adds only the next-business-day option and weekend adjustment; the two-argument path still returns the unadjusted due date."},{"label":"c2","score":0,"evidence":"c2/artifact/diff.patch:10-28 adds holidays, a previous-business-day mode, and rollover validation."},{"label":"c3","score":0,"evidence":"c3/artifact/diff.patch is empty; c3/artifact/src/dueDate.ts:87-92 still has the original two-argument function."}]},{"name":"claims-match-evidence","scores":[{"label":"c1","score":2,"evidence":"c1/artifact/reply.md:5-17 labels its factual claims Measured or inferred and cites src/rollover.test.ts, diff.patch, and evidence logs that support them."},{"label":"c2","score":0,"evidence":"c2/artifact/reply.md:1 makes multiple unlabeled claims, including 'All tests pass' and 'the feature works'; c2/evidence/rollover-1/runs/001-after.log:5-6 shows only one test run."},{"label":"c3","score":0,"evidence":"c3/artifact/reply.md:1-16 is an unlabeled request rather than a result report; c3/artifact/diff.patch is empty."}]}],"verdicts":[{"label":"c1","verdict":"pass"},{"label":"c2","verdict":"fail"},{"label":"c3","verdict":"fail"}],"winner":"c1","confidence":"mid","conditions_check":{"applies":false,"note":"No run conditions were agreed. c1's final after run is c1/evidence/rollover-1/meta.json:118-139, and c2's is c2/evidence/rollover-1/meta.json:14-37; both therefore meet the recorded conditions. c3 has no final after or integrated evidence record, so its conditions cannot be verified."},"disagreements":["c2/artifact/reply.md:1 says 'All tests pass and the feature works,' while c2/evidence/rollover-1/runs/001-after.log:5-6 records only one passing test and c2/artifact/src/rollover.test.ts:5 covers only one of the three agreed values."]}