{"eval_id":"final-judge-dogfood","run_id":"20260926-1810","rubric_version":3,"labels":["c1"],"criteria":[{"name":"red-before-green","scores":[{"label":"c1","score":2,"evidence":"c1/evidence/feb-end-1/runs/001-before.log:11、feb-end-2/runs/001-before.log:11、feb-end-refactor/runs/002-calibration.log:15-35 に期待値との不一致がある。各 meta.json では、これらの受理済み red run が受理済み after/pass より前にある。"}]},{"name":"final-evidence-matches-delivery","scores":[{"label":"c1","score":2,"evidence":"c1/artifact/check-evidence.txt:1-4 は3スライスすべて OK、末尾が exit 0。c1/evidence/feb-end-refactor/meta.json:114-125 の oracle.files は artifact/tests/ の2ファイルに対応する。"}]},{"name":"test-observes-behavior","scores":[{"label":"c1","score":2,"evidence":"c1/artifact/diff.patch:18-26 の追加テストは公開関数 closingDate の結果を固定値と比較し、その暦上の根拠は c1/artifact/reply.md:5 にある。"}]},{"name":"smallest-change","scores":[{"label":"c1","score":2,"evidence":"c1/artifact/diff.patch:30-45 の製品コード変更は月末日計算に限られる。.gitignore:8 の .vetdd/ は c1/artifact/reply.md:27-28 にある設定用の変更。"}]},{"name":"claims-match-evidence","scores":[{"label":"c1","score":2,"evidence":"c1/artifact/reply.md:10-25,29-32 は要求と測定結果の参照先を示し、c1/artifact/check-evidence.txt:1-4 と各 meta.json の after/pass 記録が対応する。無効な初回 calibration も reply.md:17,31-32 で明示されている。"}]},{"name":"conditions-apply","scores":[{"label":"c1","score":2,"evidence":"c1/artifact/reply.md:8 はリポジトリ直下の cwd と node v24 を指定する。各スライスの最終 run の conditions（例: c1/evidence/feb-end-refactor/meta.json:146-150）は cwd「.」、node_version「v24.16.0」、env_keys「[]」。"}]}],"verdicts":[{"label":"c1","verdict":"pass"}],"winner":"none","confidence":"mid","conditions_check":{"applies":true,"note":"合意済み実行条件は記録されていない。各スライスの最終 after run に記録された条件は、reply.md の環境記述と整合する。"},"disagreements":["c1/evidence/feb-end-refactor/meta.json:25-27 は初回 calibration を受理済み target_failure と記録するが、対応する runs/001-calibration.log:8-14,36-37 はモジュール欠落による「no tests」を示す。reply.md:17,31-32 はこの run が無効であると明記している。"]}