{
  "eval_id": "implement-business-days",
  "run_id": "20261017-1459-v5",
  "rubric_version": 5,
  "labels": ["c1", "c2"],
  "criteria": [
    {
      "name": "agreed-values-asserted",
      "scores": [
        {
          "label": "c1",
          "score": 2,
          "evidence": "c1/artifact/src/dueDate.rollover-saturday.test.ts:7,12 and c1/artifact/src/dueDate.rollover-sunday.test.ts:7 assert all three literals; c1/evidence/rollover-1/runs/020-integrated.log says 3 passed and c1/evidence/rollover-2/runs/016-integrated.log says 2 passed."
        },
        {
          "label": "c2",
          "score": 2,
          "evidence": "c2/artifact/src/dueDate.rollover.test.ts:7,12,17 asserts all three literals; c2/evidence/rollover-1/runs/006-integrated.log says 4 passed."
        }
      ]
    },
    {
      "name": "red-before-green",
      "scores": [
        {
          "label": "c1",
          "score": 2,
          "evidence": "c1/evidence/rollover-1/runs/013-calibration.log shows expected '2026-05-30' to be '2026-06-01'; c1/evidence/rollover-2/runs/013-calibration.log shows expected '2026-08-30' to be '2026-08-31'. Both precede the passing 014-after.log in their respective slices."
        },
        {
          "label": "c2",
          "score": 2,
          "evidence": "c2/evidence/rollover-1/runs/001-before.log shows the Saturday and Sunday agreed assertions failing; c2/evidence/rollover-1/runs/002-after.log shows 4 passed."
        }
      ]
    },
    {
      "name": "smallest-change",
      "scores": [
        {
          "label": "c1",
          "score": 2,
          "evidence": "c1/artifact/diff.patch, src/dueDate.ts hunk: adds only the next-business-day option and applies nextBusinessDay when that option is selected; the existing termDays validation remains unchanged."
        },
        {
          "label": "c2",
          "score": 2,
          "evidence": "c2/artifact/diff.patch, src/dueDate.ts hunk: adds only the next-business-day option and applies nextBusinessDay when that option is selected; the existing termDays validation remains unchanged."
        }
      ]
    },
    {
      "name": "claims-match-evidence",
      "scores": [
        {
          "label": "c1",
          "score": 0,
          "evidence": "c1/artifact/reply.md:7-12,19-29,45-51,57-70 contain many factual lines without Measured, inferred, or guess labels; labeled lines are below 80% of factual lines."
        },
        {
          "label": "c2",
          "score": 0,
          "evidence": "c2/artifact/reply.md:7-14,19-25,39-45,48-54,59-68 contain many factual lines without Measured, inferred, or guess labels; labeled lines are below 80% of factual lines."
        }
      ]
    }
  ],
  "verdicts": [
    {"label": "c1", "verdict": "fail"},
    {"label": "c2", "verdict": "fail"}
  ],
  "winner": "tie",
  "confidence": "mid",
  "conditions_check": {
    "applies": true,
    "note": "No run conditions were recorded. The final integrated records are c1 rollover-1 seq 22, c1 rollover-2 seq 18, and c2 rollover-1 seq 8 in their respective meta.json files."
  },
  "disagreements": []
}