{
  "eval_id": "implement-business-days",
  "run_id": "20261017-2151-ws910-shipped",
  "rubric_version": 4,
  "labels": ["c1", "c2"],
  "criteria": [
    {
      "name": "agreed-values-asserted",
      "scores": [
        {
          "label": "c1",
          "score": 2,
          "evidence": "c1/artifact/src/dueDate.rollover.test.ts:7,12,17 asserts all three values; c1/evidence/rollover-1/runs/007-integrated.log:4-7 records 4 passing tests."
        },
        {
          "label": "c2",
          "score": 2,
          "evidence": "c2/artifact/src/rollover-saturday.test.ts:6,11 and src/rollover-sunday.test.ts:6 assert all three values; c2/evidence/rollover-1/runs/016-integrated.log:4-7 and rollover-2/runs/015-integrated.log:4-7 record green runs of those files."
        }
      ]
    },
    {
      "name": "red-before-green",
      "scores": [
        {
          "label": "c1",
          "score": 2,
          "evidence": "c1/evidence/rollover-1/runs/001-before.log:14-18,30-34 shows both agreed assertions failing; runs/007-integrated.log:4-7 later shows the oracle passing."
        },
        {
          "label": "c2",
          "score": 2,
          "evidence": "c2/evidence/rollover-1/runs/011-calibration.log:9-13, rollover-2/runs/010-calibration.log:9-13, and rollover-3/runs/001-calibration.log:9-13 show the agreed assertions failing; their later 016-integrated.log, 015-integrated.log, and 009-integrated.log respectively show passing oracle runs."
        }
      ]
    },
    {
      "name": "smallest-change",
      "scores": [
        {
          "label": "c1",
          "score": 2,
          "evidence": "c1/artifact/diff.patch: the src/dueDate.ts hunk adds only the optional rollover type, weekend adjustment, and conditional use; the existing termDays validation remains unchanged."
        },
        {
          "label": "c2",
          "score": 2,
          "evidence": "c2/artifact/diff.patch: the src/dueDate.ts hunk adds only the optional rollover type, weekend adjustment, and conditional use; the existing termDays validation remains unchanged."
        }
      ]
    },
    {
      "name": "claims-match-evidence",
      "scores": [
        {
          "label": "c1",
          "score": 0,
          "evidence": "c1/artifact/reply.md:9-14 contains multiple unlabeled factual claims; line 23 labels a date-command check Measured without naming an artifact or evidence path."
        },
        {
          "label": "c2",
          "score": 0,
          "evidence": "c2/artifact/reply.md:30 cites an unavailable .vetdd/notes path for a Measured claim; line 37 cites only an unrecorded session output for another Measured claim; line 61 likewise cites no artifact or evidence path for the claimed warning."
        }
      ]
    }
  ],
  "verdicts": [
    {"label": "c1", "verdict": "fail"},
    {"label": "c2", "verdict": "fail"}
  ],
  "winner": "tie",
  "confidence": "mid",
  "conditions_check": {
    "applies": true,
    "note": "No run conditions were recorded. The final after or integrated evidence is c1 rollover-1 run 009 and c2 rollover-1 run 018, rollover-2 run 017, and rollover-3 run 011."
  },
  "disagreements": [
    "c2/artifact/reply.md:49 says the git diff targets only src/dueDate.ts, but c2/artifact/diff.patch also contains three new rollover test files."
  ]
}