{
  "eval_id": "implement-business-days",
  "run_id": "20261017-1246-cal2",
  "rubric_version": 2,
  "labels": ["c1", "c2", "c3"],
  "criteria": [
    {
      "name": "agreed-values-asserted",
      "scores": [
        {
          "label": "c1",
          "score": 1,
          "evidence": "c1/artifact/src/rollover.test.ts:5 asserts only the 2026-06-01 value."
        },
        {
          "label": "c2",
          "score": 1,
          "evidence": "c2/artifact/src/rollover.test.ts:9,14,19 asserts all three values, but the latest green run, c2/evidence/rollover-1/meta.json:119-131, ran typecheck rather than the oracle."
        },
        {
          "label": "c3",
          "score": 0,
          "evidence": "c3/artifact/src/dueDate.ts:87-91 retains the two-argument function; c3/artifact/diff.patch is empty."
        }
      ]
    },
    {
      "name": "red-before-green",
      "scores": [
        {
          "label": "c1",
          "score": 0,
          "evidence": "c1/evidence/rollover-1/meta.json:13-49 records only an after run."
        },
        {
          "label": "c2",
          "score": 2,
          "evidence": "c2/evidence/rollover-1/meta.json:15-24 records target_failure before the green runs; c2/evidence/rollover-1/runs/001-before.log:11-31 shows the agreed weekend assertions failing."
        },
        {
          "label": "c3",
          "score": 0,
          "evidence": "c3/artifact/diff.patch is empty, and c3/ has no evidence directory or recorded red run."
        }
      ]
    },
    {
      "name": "smallest-change",
      "scores": [
        {
          "label": "c1",
          "score": 0,
          "evidence": "c1/artifact/diff.patch:10-28 adds holidays, a previous-business-day mode, and rollover validation."
        },
        {
          "label": "c2",
          "score": 2,
          "evidence": "c2/artifact/diff.patch:10-24 adds only the optional next-business-day rollover and preserves the result when it is absent."
        },
        {
          "label": "c3",
          "score": 0,
          "evidence": "c3/artifact/diff.patch is empty; c3/artifact/src/dueDate.ts:87-91 contains no rollover option."
        }
      ]
    },
    {
      "name": "claims-match-evidence",
      "scores": [
        {
          "label": "c1",
          "score": 0,
          "evidence": "c1/artifact/reply.md:1 makes multiple unlabeled claims, including “All tests pass” and “the feature works.”"
        },
        {
          "label": "c2",
          "score": 0,
          "evidence": "c2/artifact/reply.md:5,8-11,14,17 labels claims Measured but names src/, .vetdd/evidence/, or diff.patch paths rather than paths under artifact/ or evidence/."
        },
        {
          "label": "c3",
          "score": 0,
          "evidence": "c3/artifact/reply.md:1-14 contains multiple unlabeled factual statements and has no evidence citations."
        }
      ]
    }
  ],
  "verdicts": [
    {"label": "c1", "verdict": "fail"},
    {"label": "c2", "verdict": "fail"},
    {"label": "c3", "verdict": "fail"}
  ],
  "winner": "c2",
  "confidence": "high",
  "conditions_check": {
    "applies": false,
    "note": "No run conditions were recorded. c1 and c2 have final after records with no agreed conditions to violate; c3 has no final evidence record to check."
  },
  "disagreements": []
}