{"eval_id":"final-judge-dogfood","run_id":"20261017-1229-v7","rubric_version":7,"labels":["c1"],"criteria":[{"name":"red-before-green","scores":[{"label":"c1","score":2,"evidence":"c1/evidence/feb-end-1/runs/001-before.log and c1/evidence/feb-end-2/runs/001-before.log show February assertions failing; c1/evidence/feb-end-refactor/runs/002-calibration.log shows both failing. Each slice's meta.json records these accepted runs before accepted passing after runs."}]},{"name":"final-evidence-matches-delivery","scores":[{"label":"c1","score":2,"evidence":"c1/artifact/check-evidence.txt lists all three slices as OK and ends with `exit 0`; the files under c1/artifact/tests/ match the final runs' oracle.files in each meta.json."}]},{"name":"test-observes-behavior","scores":[{"label":"c1","score":2,"evidence":"c1/artifact/diff.patch adds public closingDate calls asserting literal `2026-02-28` and `2028-02-29`, values sourced to the calendar in c1/artifact/reply.md's Oracle section; c1/artifact/check-evidence.txt has no rule 10 failure."}]},{"name":"smallest-change","scores":[{"label":"c1","score":2,"evidence":"c1/artifact/diff.patch changes lastDayOfMonth to use day 0 of the following month, adds the two February tests, and adds the tooling `.vetdd/` ignore entry."}]},{"name":"claims-match-evidence","scores":[{"label":"c1","score":0,"evidence":"c1/artifact/reply.md has many unlabeled factual lines, including `Seam: closingDate() unit`, `Covers: month-end closing in February`, the Evidence table rows, and the `.gitignore` change description; fewer than 80% of its factual lines are labeled."}]},{"name":"conditions-apply","scores":[{"label":"c1","score":2,"evidence":"c1/artifact/reply.md says `repository root as cwd, node v24`; each final after run in c1/evidence/*/meta.json records `cwd: \".\"`, `node_version: \"v24.16.0\"`, and `env_keys: []`."}]}],"verdicts":[{"label":"c1","verdict":"fail"}],"winner":"none","confidence":"high","conditions_check":{"applies":true,"note":"No agreed run conditions were recorded. The final after runs also match the environment stated in the reply."},"disagreements":[]}