{
  "eval_id": "implement-business-days",
  "run_id": "20261017-1936-ws78",
  "rubric_version": 4,
  "labels": ["c1", "c2"],
  "criteria": [
    {
      "name": "agreed-values-asserted",
      "scores": [
        {
          "label": "c1",
          "score": 2,
          "evidence": "c1/artifact/diff.patch:48-63 asserts all three values with the third argument; c1/evidence/rollover-1/runs/008-integrated.log:4-7 records 4 passing tests."
        },
        {
          "label": "c2",
          "score": 2,
          "evidence": "c2/artifact/diff.patch:13-23 asserts all three values with the third argument; c2/evidence/rollover-1/runs/006-integrated.log:4-7 records 4 passing tests."
        }
      ]
    },
    {
      "name": "red-before-green",
      "scores": [
        {
          "label": "c1",
          "score": 2,
          "evidence": "c1/evidence/rollover-1/runs/001-before.log:13-33 shows the Saturday and Sunday assertions failing on their values; c1/evidence/rollover-1/runs/008-integrated.log:4-7 is green."
        },
        {
          "label": "c2",
          "score": 2,
          "evidence": "c2/evidence/rollover-1/runs/001-before.log:13-33 shows the Saturday and Sunday assertions failing on their values; c2/evidence/rollover-1/runs/006-integrated.log:4-7 is green."
        }
      ]
    },
    {
      "name": "smallest-change",
      "scores": [
        {
          "label": "c1",
          "score": 2,
          "evidence": "c1/artifact/diff.patch:11-37 adds only the optional next-business-day rollover and retains the prior calculation when the option is absent."
        },
        {
          "label": "c2",
          "score": 2,
          "evidence": "c2/artifact/diff.patch:41-66 adds only the optional next-business-day rollover and retains the prior calculation when the option is absent."
        }
      ]
    },
    {
      "name": "claims-match-evidence",
      "scores": [
        {
          "label": "c1",
          "score": 0,
          "evidence": "c1/artifact/reply.md:9-15 contains multiple factual claims without Measured, inferred, or guess labels."
        },
        {
          "label": "c2",
          "score": 0,
          "evidence": "c2/artifact/reply.md:48-49 contains multiple unlabeled factual claims; line 25 also labels a claim Measured without naming an artifact/ or evidence/ path that shows the output."
        }
      ]
    }
  ],
  "verdicts": [
    {"label": "c1", "verdict": "fail"},
    {"label": "c2", "verdict": "fail"}
  ],
  "winner": "tie",
  "confidence": "mid",
  "conditions_check": {
    "applies": true,
    "note": "No run conditions were agreed. The last after or integrated records are c1/evidence/rollover-1/meta.json:389-409 (run 10) and c2/evidence/rollover-1/meta.json:300-320 (run 8), so both apply."
  },
  "disagreements": []
}