{
  "eval_id": "implement-business-days",
  "run_id": "20261017-1944-ws78-sections-v5",
  "rubric_version": 5,
  "labels": ["c1", "c2"],
  "criteria": [
    {
      "name": "agreed-values-asserted",
      "scores": [
        {
          "label": "c1",
          "score": 2,
          "evidence": "c1/artifact/src/dueDate.rollover.test.ts:7,12,17 asserts all three literals; c1/evidence/rollover-1/runs/006-integrated.log:4-7 records 4 passing tests."
        },
        {
          "label": "c2",
          "score": 2,
          "evidence": "c2/artifact/src/rollover.test.ts:9,14,19 asserts all three literals; c2/evidence/rollover-1/runs/008-integrated.log:4-7 records 4 passing tests."
        }
      ]
    },
    {
      "name": "red-before-green",
      "scores": [
        {
          "label": "c1",
          "score": 2,
          "evidence": "c1/evidence/rollover-1/runs/001-before.log:13-33 shows both agreed weekend assertions failing; c1/evidence/rollover-1/runs/006-integrated.log:4-7 later shows them passing."
        },
        {
          "label": "c2",
          "score": 2,
          "evidence": "c2/evidence/rollover-1/runs/001-before.log:13-33 shows both agreed weekend assertions failing; c2/evidence/rollover-1/runs/008-integrated.log:4-7 later shows them passing."
        }
      ]
    },
    {
      "name": "smallest-change",
      "scores": [
        {
          "label": "c1",
          "score": 2,
          "evidence": "c1/artifact/diff.patch:39-66 adds only the optional weekend rollover and preserves the two-argument calculation."
        },
        {
          "label": "c2",
          "score": 2,
          "evidence": "c2/artifact/diff.patch:9-37 adds only the optional weekend rollover and preserves the two-argument calculation."
        }
      ]
    },
    {
      "name": "claims-match-evidence",
      "scores": [
        {
          "label": "c1",
          "score": 1,
          "evidence": "c1/artifact/reply.md:21 quotes check-evidence output and labels the table rows Measured; lines 31-33 label claims Measured but cite only 'the diff' rather than a file path, and lines 44-45 are unlabeled."
        },
        {
          "label": "c2",
          "score": 0,
          "evidence": "c2/artifact/reply.md:5-11,16-22,34-36,39,42-48 contain many factual lines without Measured, inferred, or guess labels; line 24 labels only its own claim."
        }
      ]
    }
  ],
  "verdicts": [
    {"label": "c1", "verdict": "partial"},
    {"label": "c2", "verdict": "fail"}
  ],
  "winner": "c1",
  "confidence": "mid",
  "conditions_check": {
    "applies": true,
    "note": "No agreed run conditions were recorded. The last integrated runs are c1 seq 8 and c2 seq 10 in their respective evidence/rollover-1/meta.json files."
  },
  "disagreements": []
}