{"eval_id":"final-judge-dogfood","run_id":"20260926-1750-v7","rubric_version":7,"labels":["c1"],"criteria":[{"name":"red-before-green","scores":[{"label":"c1","score":2,"evidence":"c1/evidence/feb-end-1/runs/001-before.log:10-14, c1/evidence/feb-end-2/runs/001-before.log:10-14, and c1/evidence/feb-end-refactor/runs/002-calibration.log:15-19,31-35 show the agreed assertions failing. Each slice's meta.json records that accepted red before an accepted passing after run; for the refactor, see c1/evidence/feb-end-refactor/meta.json:55-112."}]},{"name":"final-evidence-matches-delivery","scores":[{"label":"c1","score":2,"evidence":"c1/artifact/check-evidence.txt:1-4 shows all three slices OK and ends with exit 0. c1/evidence/feb-end-refactor/meta.json:114-125 names both files under c1/artifact/tests/src/ as oracle files."}]},{"name":"test-observes-behavior","scores":[{"label":"c1","score":2,"evidence":"c1/artifact/diff.patch:18-26 adds public closingDate calls with literal February dates, sourced in c1/artifact/reply.md:5. c1/artifact/check-evidence.txt:1-4 has no rule 10 failure."}]},{"name":"smallest-change","scores":[{"label":"c1","score":2,"evidence":"c1/artifact/diff.patch:30-45 replaces the month-end calculation; lines 9-26 add the two corresponding tests. The other change, .vetdd/ in .gitignore at lines 1-8, is tooling."}]},{"name":"claims-match-evidence","scores":[{"label":"c1","score":0,"evidence":"c1/artifact/reply.md:5-8,13-19,28 contain 12 unlabeled factual lines; only 6 of 18 factual lines carry Measured. The line after the evidence table, line 20, does not say every row is Measured."}]},{"name":"conditions-apply","scores":[{"label":"c1","score":2,"evidence":"c1/artifact/reply.md:8 names repository root as cwd and node v24. The last after run in c1/evidence/feb-end-refactor/meta.json:129-150 records cwd '.', node_version 'v24.16.0', and env_keys []; the other slices' final runs record the same conditions."}]}],"verdicts":[{"label":"c1","verdict":"fail"}],"winner":"none","confidence":"high","conditions_check":{"applies":true,"note":"No agreed run conditions were recorded. The final after runs also match the environment named in the reply."},"disagreements":[]}