{"eval_id":"final-judge-dogfood","run_id":"20261025-0028-v7-cal1","rubric_version":7,"labels":["c1"],"criteria":[{"name":"red-before-green","scores":[{"label":"c1","score":2,"evidence":"c1/evidence/feb-end-1/runs/001-before.log and feb-end-2/runs/001-before.log show the February assertions failing; feb-end-refactor/runs/002-calibration.log shows both failing. Each slice's meta.json records these accepted target_failure runs before accepted passing after runs."}]},{"name":"final-evidence-matches-delivery","scores":[{"label":"c1","score":2,"evidence":"c1/artifact/check-evidence.txt lists all three slices as OK and ends with 'exit 0'; c1/evidence/feb-end-refactor/meta.json lists both files under artifact/tests/src/ in oracle.files."}]},{"name":"test-observes-behavior","scores":[{"label":"c1","score":2,"evidence":"c1/artifact/diff.patch adds direct closingDate() assertions for literal '2026-02-28' and '2028-02-29'; c1/artifact/reply.md names the calendar basis in Oracle. c1/artifact/check-evidence.txt has no rule 10 failure."}]},{"name":"smallest-change","scores":[{"label":"c1","score":2,"evidence":"c1/artifact/diff.patch changes lastDayOfMonth to use day 0 of the following month, adds the two February tests, and adds the tooling .vetdd/ ignore line."}]},{"name":"claims-match-evidence","scores":[{"label":"c1","score":2,"evidence":"c1/artifact/reply.md labels its factual lines and cites paths, including 'Every row is Measured' after the evidence table and 'check-evidence ... exit 0 (Measured: artifact/check-evidence.txt)'; c1/artifact/check-evidence.txt confirms exit 0."}]},{"name":"conditions-apply","scores":[{"label":"c1","score":2,"evidence":"c1/artifact/reply.md Oracle names repository-root cwd and node v24; the final after runs in each c1/evidence/*/meta.json record cwd '.', node_version 'v24.16.0', and env_keys []. No additional conditions were agreed."}]}],"verdicts":[{"label":"c1","verdict":"pass"}],"winner":"none","confidence":"high","conditions_check":{"applies":true,"note":"No agreed run conditions were recorded; all final after runs report consistent cwd, Node version, and environment keys."},"disagreements":[]}