{"eval_id":"implement-business-days","run_id":"20261017-1505-v4","rubric_version":4,"labels":["c1","c2"],"criteria":[{"name":"agreed-values-asserted","scores":[{"label":"c1","score":2,"evidence":"c1/artifact/src/dueDate.rollover.test.ts:7,12,17 asserts all three literals; c1/evidence/rollover-1/runs/021-integrated.log:4-7 shows the four tests passing after the final oracle change."},{"label":"c2","score":2,"evidence":"c2/artifact/src/dueDate.rollover.test.ts:7,12,17 asserts all three literals; c2/evidence/rollover-1/runs/008-integrated.log:4-7 shows the four tests passing."}]},{"name":"red-before-green","scores":[{"label":"c1","score":2,"evidence":"c1/evidence/rollover-1/runs/013-calibration.log:11-15,27-31 shows both agreed weekend assertions failing; c1/evidence/rollover-1/runs/021-integrated.log:4-7 is the later green run."},{"label":"c2","score":2,"evidence":"c2/evidence/rollover-1/runs/002-before.log:13-17,29-33 shows both agreed weekend assertions failing; c2/evidence/rollover-1/runs/008-integrated.log:4-7 is the later green run."}]},{"name":"smallest-change","scores":[{"label":"c1","score":2,"evidence":"c1/artifact/diff.patch: paymentDueDate gains only the optional next-business-day rollover; the existing term validation and two-argument return behavior remain."},{"label":"c2","score":2,"evidence":"c2/artifact/diff.patch: paymentDueDate gains only the optional next-business-day rollover; the existing term validation and two-argument return behavior remain."}]},{"name":"claims-match-evidence","scores":[{"label":"c1","score":0,"evidence":"c1/artifact/reply.md:7-16 and 43-56 contain multiple factual claims without Measured, inferred, or guess labels."},{"label":"c2","score":0,"evidence":"c2/artifact/reply.md:7-9 and 37-48 contain multiple factual claims without Measured, inferred, or guess labels."}]}],"verdicts":[{"label":"c1","verdict":"fail"},{"label":"c2","verdict":"fail"}],"winner":"tie","confidence":"mid","conditions_check":{"applies":true,"note":"No run conditions were recorded. The final after or integrated records are c1/evidence/rollover-1/meta.json run 23 and c2/evidence/rollover-1/meta.json run 10."},"disagreements":[]}