{"eval_id":"final-judge-dogfood","run_id":"20261017-1229","rubric_version":3,"labels":["c1"],"criteria":[{"name":"red-before-green","scores":[{"label":"c1","score":2,"evidence":"c1/evidence/feb-end-1/runs/001-before.log: expected 2026-02-28, received 2026-03-31; c1/evidence/feb-end-2/runs/001-before.log: expected 2028-02-29, received 2028-03-31; c1/evidence/feb-end-refactor/runs/002-calibration.log shows both assertion failures. Each slice's meta.json records these accepted red runs before accepted passing after runs."}]},{"name":"final-evidence-matches-delivery","scores":[{"label":"c1","score":2,"evidence":"c1/artifact/check-evidence.txt:1-4 lists all three slices as OK and ends with exit 0; c1/evidence/feb-end-refactor/meta.json:6-14 names both paths supplied under c1/artifact/tests/."}]},{"name":"test-observes-behavior","scores":[{"label":"c1","score":2,"evidence":"c1/artifact/diff.patch:18-25 adds public closingDate calls asserting literal February 28 and February 29 results; their calendar source is stated in c1/artifact/reply.md:5."}]},{"name":"smallest-change","scores":[{"label":"c1","score":2,"evidence":"c1/artifact/diff.patch:37-44 changes only the month-end calculation in product code; lines 18-25 add the corresponding tests. The .vetdd/ ignore entry is identified as tooling in c1/artifact/reply.md:28."}]},{"name":"claims-match-evidence","scores":[{"label":"c1","score":2,"evidence":"c1/artifact/reply.md:13-25 maps the behavior and passing-run claims to red logs, named local after logs, and meta.json records; c1/artifact/check-evidence.txt:1-4 records OK for every slice and exit 0. The reply identifies the invalid first calibration at lines 17 and 32."}]},{"name":"conditions-apply","scores":[{"label":"c1","score":2,"evidence":"c1/artifact/reply.md:8 specifies repository-root cwd and node v24; the final after runs' conditions in c1/evidence/feb-end-1/meta.json, c1/evidence/feb-end-2/meta.json, and c1/evidence/feb-end-refactor/meta.json record cwd '.', node_version 'v24.16.0', and env_keys []."}]}],"verdicts":[{"label":"c1","verdict":"pass"}],"winner":"none","confidence":"mid","conditions_check":{"applies":true,"note":"No separate run conditions were recorded. All three slices' final after runs are consistent with the environment stated in c1/artifact/reply.md:8."},"disagreements":["c1/evidence/feb-end-refactor/meta.json:25-27 marks calibration 001 as accepted target_failure, but c1/evidence/feb-end-refactor/runs/001-calibration.log:8-14,36-37 shows a missing module and no tests. The reply acknowledges that this calibration is invalid; calibration 002 supplies the valid red run."]}